{
  "$schema": "https://json-schema.org/draft/2020-12/schema",
  "$id": "https://ptywright.local/schemas/ptywright-agent-cassette.schema.json",
  "title": "ptywright agent cassette",
  "type": "object",
  "additionalProperties": false,
  "required": ["version", "name", "createdAt", "spec", "frames"],
  "properties": {
    "$schema": { "type": "string" },
    "version": { "const": 1 },
    "name": { "type": "string", "minLength": 1 },
    "createdAt": { "type": "string", "minLength": 1 },
    "spec": { "$ref": "./ptywright-agent.schema.json" },
    "frames": {
      "type": "array",
      "minItems": 1,
      "items": {
        "type": "object",
        "additionalProperties": false,
        "required": [
          "viewport",
          "phase",
          "stepIndex",
          "stepType",
          "terminalText",
          "terminalHash",
          "dom",
          "domHash",
          "capturedAt"
        ],
        "properties": {
          "viewport": {
            "type": "object",
            "additionalProperties": false,
            "required": ["name", "width", "height"],
            "properties": {
              "name": { "type": "string", "minLength": 1 },
              "width": { "type": "integer", "minimum": 1 },
              "height": { "type": "integer", "minimum": 1 },
              "deviceScaleFactor": { "type": "number", "exclusiveMinimum": 0 },
              "isMobile": { "type": "boolean" },
              "hasTouch": { "type": "boolean" }
            }
          },
          "phase": { "type": "integer", "minimum": 0 },
          "stepIndex": { "type": ["integer", "null"], "minimum": 0 },
          "stepType": { "type": "string", "minLength": 1 },
          "terminalText": { "type": "string" },
          "terminalHash": { "type": "string", "minLength": 1 },
          "dom": { "type": "string" },
          "domHash": { "type": "string", "minLength": 1 },
          "capturedAt": { "type": "string", "minLength": 1 }
        }
      }
    }
  }
}
