{
  "$schema": "https://ptywright.local/schemas/ptywright-agent-cassette.schema.json",
  "version": 1,
  "name": "agent_deterministic",
  "createdAt": "2026-05-23T23:59:25.412Z",
  "spec": {
    "name": "agent_deterministic",
    "artifactsDir": ".tmp/agent/agent_deterministic",
    "snapshotDir": "tests/agent-snapshots/agent_deterministic",
    "launch": {
      "mode": "aitty",
      "command": "bun",
      "args": ["run", "tests/fixtures/deterministic_agent.ts"],
      "aitty": {
        "project": "ptywright",
        "label": "deterministic-agent",
        "title": "deterministic agent",
        "subtitle": "browser regression fixture",
        "theme": "light",
        "fontSize": 14,
        "waitForUrlMs": 15000
      }
    },
    "viewports": [
      {
        "name": "desktop",
        "width": 1280,
        "height": 820
      },
      {
        "name": "mobile",
        "width": 390,
        "height": 844,
        "isMobile": true,
        "hasTouch": true
      }
    ],
    "defaults": {
      "timeoutMs": 30000,
      "screenshot": true
    },
    "steps": [
      {
        "type": "waitForText",
        "text": "Deterministic Agent Ready"
      },
      {
        "type": "snapshot",
        "name": "ready",
        "targets": ["terminal", "dom", "screenshot"]
      },
      {
        "type": "typeText",
        "text": "status",
        "enter": true
      },
      {
        "type": "waitForText",
        "text": "Status: stable"
      },
      {
        "type": "waitForStableDom"
      },
      {
        "type": "snapshot",
        "name": "status",
        "targets": ["terminal", "dom", "screenshot"]
      }
    ]
  },
  "frames": [
    {
      "viewport": {
        "name": "desktop",
        "width": 1280,
        "height": 820
      },
      "phase": 0,
      "stepIndex": 1,
      "stepType": "snapshot",
      "terminalText": "Deterministic Agent Ready\nType help or status. Ctrl+C exits.\nagent[1]>",
      "dom": "<div data-terminal-transcript-archive=\"\" class=\"term-transcript-archive\" aria-hidden=\"false\"><div class=\"term-transcript-spacer term-transcript-spacer-top\"></div><pre class=\"term-transcript-visible\" data-virtual-start=\"0\" data-virtual-end=\"0\"></pre><div class=\"term-transcript-spacer term-transcript-spacer-bottom\"></div></div><div class=\"term-grid\" data-cols=\"139\" data-rows=\"24\" style=\"--term-cols: 139; --term-rows: 24;\"><div class=\"term-row\" data-aitty-live-grid-row=\"1\"><span data-aitty-cell-cols=\"139\" style=\"width: calc(var(--term-cell-width, 1ch) * 139);\">Deterministic Agent Ready </span></div><div class=\"term-row\" data-aitty-live-grid-row=\"2\"><span data-aitty-cell-cols=\"139\" style=\"width: calc(var(--term-cell-width, 1ch) * 139);\">Type help or status. Ctrl+C exits. </span></div><div class=\"term-row\" data-aitty-live-grid-row=\"3\" data-aitty-live-input-row=\"true\"><span data-aitty-cell-cols=\"10\" style=\"width: calc(var(--term-cell-width, 1ch) * 10);\">agent[1]&gt; </span><span class=\"term-cursor\" data-aitty-cell-cols=\"1\" style=\"width: var(--term-cell-width, 1ch);\"></span><span data-aitty-cell-cols=\"128\" style=\"width: calc(var(--term-cell-width, 1ch) * 128);\"></span></div><div class=\"term-row\" data-aitty-live-grid-row=\"4\"><span data-aitty-cell-cols=\"139\" style=\"width: calc(var(--term-cell-width, 1ch) * 139);\"></span></div><div class=\"term-row\" data-aitty-live-grid-row=\"5\"><span data-aitty-cell-cols=\"139\" style=\"width: calc(var(--term-cell-width, 1ch) * 139);\"></span></div><div class=\"term-row\" data-aitty-live-grid-row=\"6\"><span data-aitty-cell-cols=\"139\" style=\"width: calc(var(--term-cell-width, 1ch) * 139);\"></span></div><div class=\"term-row\" data-aitty-live-grid-row=\"7\"><span data-aitty-cell-cols=\"139\" style=\"width: calc(var(--term-cell-width, 1ch) * 139);\"></span></div><div class=\"term-row\" data-aitty-live-grid-row=\"8\"><span data-aitty-cell-cols=\"139\" style=\"width: calc(var(--term-cell-width, 1ch) * 139);\"></span></div><div class=\"term-row\" data-aitty-live-grid-row=\"9\"><span data-aitty-cell-cols=\"139\" style=\"width: calc(var(--term-cell-width, 1ch) * 139);\"></span></div><div class=\"term-row\" data-aitty-live-grid-row=\"10\"><span data-aitty-cell-cols=\"139\" style=\"width: calc(var(--term-cell-width, 1ch) * 139);\"></span></div><div class=\"term-row\" data-aitty-live-grid-row=\"11\"><span data-aitty-cell-cols=\"139\" style=\"width: calc(var(--term-cell-width, 1ch) * 139);\"></span></div><div class=\"term-row\" data-aitty-live-grid-row=\"12\"><span data-aitty-cell-cols=\"139\" style=\"width: calc(var(--term-cell-width, 1ch) * 139);\"></span></div><div class=\"term-row\" data-aitty-live-grid-row=\"13\"><span data-aitty-cell-cols=\"139\" style=\"width: calc(var(--term-cell-width, 1ch) * 139);\"></span></div><div class=\"term-row\" data-aitty-live-grid-row=\"14\"><span data-aitty-cell-cols=\"139\" style=\"width: calc(var(--term-cell-width, 1ch) * 139);\"></span></div><div class=\"term-row\" data-aitty-live-grid-row=\"15\"><span data-aitty-cell-cols=\"139\" style=\"width: calc(var(--term-cell-width, 1ch) * 139);\"></span></div><div class=\"term-row\" data-aitty-live-grid-row=\"16\"><span data-aitty-cell-cols=\"139\" style=\"width: calc(var(--term-cell-width, 1ch) * 139);\"></span></div><div class=\"term-row\" data-aitty-live-grid-row=\"17\"><span data-aitty-cell-cols=\"139\" style=\"width: calc(var(--term-cell-width, 1ch) * 139);\"></span></div><div class=\"term-row\" data-aitty-live-grid-row=\"18\"><span data-aitty-cell-cols=\"139\" style=\"width: calc(var(--term-cell-width, 1ch) * 139);\"></span></div><div class=\"term-row\" data-aitty-live-grid-row=\"19\"><span data-aitty-cell-cols=\"139\" style=\"width: calc(var(--term-cell-width, 1ch) * 139);\"></span></div><div class=\"term-row\" data-aitty-live-grid-row=\"20\"><span data-aitty-cell-cols=\"139\" style=\"width: calc(var(--term-cell-width, 1ch) * 139);\"></span></div><div class=\"term-row\" data-aitty-live-grid-row=\"21\"><span data-aitty-cell-cols=\"139\" style=\"width: calc(var(--term-cell-width, 1ch) * 139);\"></span></div><div class=\"term-row\" data-aitty-live-grid-row=\"22\"><span data-aitty-cell-cols=\"139\" style=\"width: calc(var(--term-cell-width, 1ch) * 139);\"></span></div><div class=\"term-row\" data-aitty-live-grid-row=\"23\"><span data-aitty-cell-cols=\"139\" style=\"width: calc(var(--term-cell-width, 1ch) * 139);\"></span></div><div class=\"term-row\" data-aitty-live-grid-row=\"24\"><span data-aitty-cell-cols=\"139\" style=\"width: calc(var(--term-cell-width, 1ch) * 139);\"></span></div></div>",
      "capturedAt": "2026-05-23T23:59:27.331Z",
      "terminalHash": "86619447",
      "domHash": "90dfbfee"
    },
    {
      "viewport": {
        "name": "desktop",
        "width": 1280,
        "height": 820
      },
      "phase": 1,
      "stepIndex": 5,
      "stepType": "snapshot",
      "terminalText": "Deterministic Agent Ready\nType help or status. Ctrl+C exits.\nagent[1]> status\n\nStatus: stable\nMode: browser regression\nagent[2]>",